{
  "lockfileVersion": 1,
  "generatedAt": 1704067200000,
  "skills": [
    {
      "name": "ao-basics",
      "version": "1.0.0",
      "arweaveTxId": "abc123def456ghi789jkl012mno345pqr678stu901",
      "installedAt": 1704067200000,
      "installedPath": "~/.claude/skills/ao-basics/",
      "dependencies": [],
      "isDirectDependency": true
    },
    {
      "name": "arweave-fundamentals",
      "version": "2.0.0",
      "arweaveTxId": "xyz789abc012def345ghi678jkl901mno234pqr567",
      "installedAt": 1704067300000,
      "installedPath": "~/.claude/skills/arweave-fundamentals/",
      "dependencies": [],
      "isDirectDependency": true
    }
  ],
  "installLocation": "~/.claude/skills/"
}
